{
  "contract_version": "flyto.capability-plan.v1",
  "plan_id": "shortcut.forward.30cm.v1",
  "resource_id": "flyto-tb3-lab-001",
  "goal": "前進三十公分後安全停止",
  "generated_by": {
    "kind": "human",
    "provider": "flyto-cloud",
    "model": "workflow-card"
  },
  "steps": [
    {
      "step_id": "move.forward",
      "capability": "move_relative",
      "arguments": {
        "distance_m": 0.3,
        "speed": 0.12
      },
      "timeout_seconds": 5.0,
      "on_failure": "abort"
    },
    {
      "step_id": "stop.finish",
      "capability": "safe_stop",
      "arguments": {
        "seconds": 0.0
      },
      "timeout_seconds": 1.0,
      "on_failure": "abort"
    }
  ]
}
