{
  "contract_version": "flyto.capability-plan.v1",
  "plan_id": "semantic-location-sequence.v1",
  "resource_id": "flyto-rover-sim-001",
  "goal": "先去藍線終點，再去黃線終點，最後去紫線終點並安全停止。",
  "generated_by": {
    "kind": "llm",
    "provider": "flyto-ai",
    "model": "planner-demo"
  },
  "steps": [
    {
      "step_id": "route.blue",
      "capability": "navigate_to_location",
      "arguments": {
        "location_id": "hospital.route.blue_end"
      },
      "timeout_seconds": 30.0,
      "on_failure": "request_replan"
    },
    {
      "step_id": "route.yellow",
      "capability": "navigate_to_location",
      "arguments": {
        "location_id": "hospital.route.yellow_end"
      },
      "timeout_seconds": 30.0,
      "on_failure": "request_replan"
    },
    {
      "step_id": "route.purple",
      "capability": "navigate_to_location",
      "arguments": {
        "location_id": "hospital.route.purple_end"
      },
      "timeout_seconds": 30.0,
      "on_failure": "request_replan"
    },
    {
      "step_id": "stop.finish",
      "capability": "safe_stop",
      "arguments": {
        "seconds": 1.0
      },
      "timeout_seconds": 2.0,
      "on_failure": "abort"
    }
  ]
}
